{
  "schemaVersion": "1.0",
  "bundle": {
    "id": "fixture:active.feature->active.tooling:2026-05-26T00:00:00.000Z",
    "createdAt": "2026-05-26T00:00:00.000Z",
    "createdBy": "test",
    "status": "draft"
  },
  "package": {
    "name": "@fixture/tooling-transition",
    "path": "packages/tooling-transition/package.json",
    "owner": "team-a"
  },
  "transition": {
    "fromClass": "active.feature",
    "toClass": "active.tooling",
    "reason": "Representative transition",
    "requestedAt": "2026-05-26T00:00:00.000Z"
  },
  "governance": {
    "decisionRefs": [
      "ADR-0010"
    ],
    "reviewers": [
      {
        "name": "Reviewer",
        "role": "reviewer",
        "reviewedAt": "2026-05-26T00:00:00.000Z"
      }
    ],
    "approvers": [
      {
        "name": "Approver",
        "role": "approver",
        "reviewedAt": "2026-05-26T00:00:00.000Z"
      }
    ]
  },
  "risk": {
    "level": "medium",
    "assessment": "Low implementation risk after review.",
    "mitigations": [
      "Run tests"
    ]
  },
  "testing": {
    "summary": "Fixture test evidence.",
    "evidence": [
      {
        "path": "reports/testing/example.json",
        "description": "Example test evidence"
      }
    ]
  },
  "impact": {
    "runtimeImpact": "None expected.",
    "consumerImpact": "Consumers reviewed."
  },
  "rollback": {
    "strategy": "Revert lifecycle metadata.",
    "notes": "Fixture rollback."
  },
  "sourceMetadataSnapshot": {
    "packageJsonPath": "packages/tooling-transition/package.json",
    "architecture": {
      "lifecycle": {
        "class": "active.feature"
      }
    }
  },
  "reportReferences": [
    {
      "path": "reports/lifecycle/package-lifecycle-summary.json",
      "description": "Lifecycle report"
    }
  ]
}
